//Answers for Workshop 2

Exercise 1:

Used:
use decodemtl_addressbook
source data/import-table-structure.sql;
Find + Replace decodemtl_addressbook_import to decodemtl_addressbook

Result:
Query OK, 0 rows affected, 1 warning (0.00 sec)

Query OK, 1 row affected (0.00 sec)

Database changed
Query OK, 0 rows affected, 1 warning (0.00 sec)

Query OK, 0 rows affected (0.02 sec)

Query OK, 0 rows affected, 1 warning (0.00 sec)

Query OK, 0 rows affected (0.01 sec)

Query OK, 0 rows affected, 1 warning (0.00 sec)

Query OK, 0 rows affected (0.01 sec)

mysql> show tables
    -> ;
+----------------------------------------+
| Tables_in_decodemtl_addressbook        |
+----------------------------------------+
| Account                                |
| AddressBook                            |
| Entry                                  |
+----------------------------------------+
3 rows in set (0.00 sec)

Exercise 2:

Account:
Used:
INSERT INTO Account SET id=NULL, email="jim@email.com", password="jimspass", createdOn="2017-01-24";
SELECT * FROM Account;


AddressBook:
Used:
INSERT INTO AddressBook SET id=NULL, accountId="123", name="Loren Ipsom Inc", createdOn="2017-01-20", modifiedOn="2017-01-23";


Entry:
INSERT INTO Entry SET id=NULL, 
addressBookId="134", firstName="Loren", lastName="Ipsum", 
birthday="1989-01-05", type="home", subtype="phone", 
contentLineOne="514-625-6432", contentLineTwo=NULL;

INSERT INTO Entry SET id=NULL, 
addressBookId="134", firstName="Pizza", lastName="Face", 
birthday="1970-01-12", type="work", subtype="phone", 
contentLineOne="514-462-6432", contentLineTwo=NULL;

INSERT INTO Entry SET id=NULL, 
addressBookId="134", firstName="Mayor", lastName="McCheese", 
birthday="1989-01-05", type="other", subtype="address", 
contentLineOne="514-095-6452", contentLineTwo=NULL;

Exercise 3:

SELECT * FROM Account;
+----+---------------+----------+---------------------+------------+
| id | email         | password | createdOn           | modifiedOn |
+----+---------------+----------+---------------------+------------+
|  1 | jim@email.com | jimspass | 0000-00-00 00:00:00 | NULL       |
+----+---------------+----------+---------------------+------------+
1 row in set (0.00 sec)


SELECT * FROM AddressBook;
+----+-----------+-----------------+---------------------+---------------------+
| id | accountId | name            | createdOn           | modifiedOn          |
+----+-----------+-----------------+---------------------+---------------------+
|  1 |       123 | Loren Ipsom Inc | 2017-01-20 00:00:00 | 2017-01-23 00:00:00 |
+----+-----------+-----------------+---------------------+---------------------+
1 row in set (0.00 sec)


Select * FROM Entry;
+----+---------------+-----------+----------+---------------------+-------+---------+----------------+----------------+------------------+-----------------+-----------------+
| id | addressBookId | firstName | lastName | birthday            | type  | subtype | contentLineOne | contentLineTwo | contentLineThree | contentLineFour | contentLineFive |
+----+---------------+-----------+----------+---------------------+-------+---------+----------------+----------------+------------------+-----------------+-----------------+
|  1 |           134 | Loren     | Ipsum    | 1989-01-05 00:00:00 | home  | phone   | 514-625-6432   | NULL           | NULL             | NULL            | NULL            |
|  2 |           134 | Pizza     | Face     | 1970-01-12 00:00:00 | work  | phone   | 514-462-6432   | NULL           | NULL             | NULL            | NULL            |
|  3 |           134 | Mayor     | McCheese | 1989-01-05 00:00:00 | other | address | 514-095-6452   | NULL           | NULL             | NULL            | NULL            |
+----+---------------+-----------+----------+---------------------+-------+---------+----------------+----------------+------------------+-----------------+-----------------+
3 rows in set (0.01 sec)

Exercise 4:

UPDATE Account SET email="Jimiscool@email.com" WHERE id=1;

UPDATE AddressBook SET name="Lauren Ipsom" WHERE id=1;

UPDATE Entry SET type="home" WHERE id IN (1,2,3);

Exercise 5:

TRUNCATE table Entry;
DESCRIBE Entry;

Result:
SELECT * FROM Entry;
Empty set (0.01 sec)

Exercise 6:
DROP TABLE Account;

Result:
SELECT * FROM Account;
ERROR 1146 (42S02): Table 'decodemtl_addressbook.Account' doesn't exist

Exercise 7:
CREATE DATABASE decodemtl_addressbook_import;
source data/import-table-structure.sql;

Result:
SHOW TABLES;
+----------------------------------------+
| Tables_in_decodemtl_addressbook_import |
+----------------------------------------+
| Account                                |
| AddressBook                            |
| Entry                                  |
+----------------------------------------+
3 rows in set (0.00 sec)

Pt 2:
USE decodemtl_addressbook_import;
source data/import-account.sql;
source data/import-addressbook.sql;
source data/import-entry.sql;